{
  "$schema": "https://json-schema.org/draft/2020-12/schema",
  "$id": "https://wattaman.app/schemas/extension-manifest-v1.schema.json",
  "title": "Wattaman Declarative Extension Manifest v1",
  "type": "object",
  "additionalProperties": false,
  "required": ["schemaVersion", "key", "name", "version", "runtimeType", "permissions", "navigation", "pages", "resources"],
  "properties": {
    "schemaVersion": { "const": 1 },
    "key": { "type": "string", "pattern": "^[A-Z][A-Z0-9_]{1,63}$" },
    "name": { "type": "string", "minLength": 1, "maxLength": 120 },
    "version": { "type": "string", "pattern": "^\\d+\\.\\d+\\.\\d+(?:-[0-9A-Za-z.-]+)?$" },
    "runtimeType": { "const": "DECLARATIVE_MODULE" },
    "permissions": { "type": "array", "uniqueItems": true, "items": { "type": "string", "pattern": "^[a-z][a-z0-9_-]*:(read|write)$" } },
    "navigation": { "type": "array", "items": { "type": "object", "required": ["label", "pageKey", "roles"], "properties": { "label": { "type": "string" }, "pageKey": { "type": "string" }, "icon": { "type": "string" }, "section": { "type": "string" }, "roles": { "type": "array", "items": { "type": "string" } } } } },
    "pages": { "type": "array", "minItems": 1 },
    "resources": { "type": "object", "minProperties": 1 },
    "assets": { "type": "array", "items": { "type": "string" } }
  },
  "patternProperties": { "^x-": true }
}
